{"schema_version":"1.0.0","product_id":"ngin","name":"NGIN","status":"active","purpose":"Compose organizational, institutional and territorial operating capabilities for entities that govern, employ, serve, produce, transact and coordinate at scale.","entities":["organization","institution","government","territory","enterprise","agent","resource"],"domain_capabilities":["organizational operations","institutional registries","workforce","service delivery","territorial coordination"],"consumed_capabilities":["cap.identity","cap.discovery","cap.matching","cap.authority","cap.workflow","cap.interoperability"],"provided_capabilities":["organizational/territorial operating compositions"],"workflows":["register→qualify→authorize→compose→execute→evidence→reconcile→report"],"interfaces":["organization UI","API","agent/tool","registry adapters"],"providers_adapters":["institutional registries","government/enterprise connectors"],"authority_model":"Organizational and territorial authority is scoped by the applicable human/legal/institutional authority boundary; NGIN cannot self-elevate authority.","data_model":"Entity, role, membership, capability, workflow, evidence and relationship records with jurisdiction/context.","evidence_model":"Operational and institutional actions retain evidence, provenance, authorization and accountable actor context.","economic_model":"Can compose economic participation but delegates universal Value, Exchange, Settlement and I/O semantics.","pulse_model":"Operational outcomes and value observations feed canonical Pulse pathways.","continuity_model":"Institutional state, obligations, evidence and handoffs survive deployment or provider changes.","exit_handoff":"Package organizational/territorial identity, active workflows, obligations, evidence, authority and integrations for canonical handoff.","compatibility_identifiers":["NGIN","organizational and territorial operating environment"]}
