{"schema_version":"1.0.0","product_id":"abba","name":"ABBA Master AI","status":"active","purpose":"Master ecosystem/world intelligence and orchestration across canonical capabilities, participants, products, agents and missions.","entities":["human","AI entity","agent","organization","product","capability","team","mission"],"domain_capabilities":["reasoning","routing","composition","SWIRM/TEAM/MISSION orchestration","monitoring","escalation"],"consumed_capabilities":["cap.identity","cap.authority","cap.discovery","cap.matching","cap.workflow","cap.interoperability"],"provided_capabilities":["orchestration composition"],"workflows":["understand→discover→compose→authorize→execute→observe→reconcile→learn"],"interfaces":["agent/tool","API","event","human interaction"],"providers_adapters":["model/provider adapters","tool/capability adapters"],"authority_model":"ABBA orchestrates within declared authority and cannot issue constitutional authority, rewrite higher-order law or substitute required human authority.","data_model":"Canonical intent, capability, authority, workflow, event, evidence, state and provenance references.","evidence_model":"Decisions and inferences remain distinguishable from source facts, evidence and observations.","economic_model":"May coordinate economic capabilities but does not create competing Value/Ledger semantics.","pulse_model":"Uses canonical feedback and outcome signals to learn without turning Pulse into authority or value source-of-truth.","continuity_model":"Mission and orchestration state survives product/provider changes with explicit handoffs.","exit_handoff":"Persist mission, task, authority, evidence, state and pending obligations into canonical receiving records.","compatibility_identifiers":["ABBA Master AI","ABBA","ABBA MAS"]}
