{"schema_version":"1.0.0","product_id":"omni-economic","name":"OMNI Economic Participation","status":"active","purpose":"Compose economic participation across trade, markets, investment, exchange, sourcing, capacity, logistics and settlement using canonical ecosystem capabilities.","entities":["human","organization","agent","resource","service","offer","need","order","transaction"],"domain_capabilities":["trade composition","economic coordination","sourcing","market participation","settlement coordination"],"consumed_capabilities":["cap.identity","cap.discovery","cap.matching","cap.authority","cap.workflow","cap.interoperability"],"provided_capabilities":["economic coordination compositions"],"workflows":["seek→match→authorize→negotiate→commit→handoff→settle→reconcile"],"interfaces":["API","agent/tool","human UI","provider adapters"],"providers_adapters":["PAPSS/financial providers through adapters","logistics/providers through adapters","SPOTIST for universal SEEK"],"authority_model":"Consumes scoped human/entity authority and canonical authorization; matching/readiness never grant authority.","data_model":"Canonical identity, relationship, offer/order/transaction/event/evidence records with provenance and historical identifiers.","evidence_model":"Negotiation, supply, inspection, handoff and settlement evidence remains linked to the causal event chain.","economic_model":"Economic domain composition; not a replacement for universal Value or I/O semantics.","pulse_model":"Emits outcome and value observations through canonical Pulse pathways.","continuity_model":"Preserve commitments, evidence, obligations and events across retries, provider changes and product exit.","exit_handoff":"Export canonical participant, capability, obligation, transaction, evidence and event references to OMNII/HAPI/I-O receiving capabilities.","compatibility_identifiers":["repo:carbonactual/desk","product_id:desk","Desk* internal object names"]}
