{"schema_version":"1.0.0","product_id":"spotist","name":"SPOTIST","status":"active","purpose":"Universal SEEK capability: understand what a participant is looking for, discover and match lawful candidates, verify and trace outcomes, and coordinate the seek across domains.","entities":["human","organization","agent","service","resource","place","information","opportunity","relationship"],"domain_capabilities":["natural-language seek","discovery","matching","qualification","verification","tracing","monitoring"],"consumed_capabilities":["cap.identity","cap.discovery","cap.matching","cap.authority","cap.workflow","cap.interoperability"],"provided_capabilities":["universal seek/discovery composition"],"workflows":["specify→interpret→discover→match→qualify→verify→present→coordinate→monitor→close"],"interfaces":["human conversation","API","agent/tool","workflow"],"providers_adapters":["search/index adapters","domain registries","external service/provider adapters"],"authority_model":"Discovery and matching do not grant authority; sensitive searches require lawful purpose, privacy and safeguarding constraints.","data_model":"Seek intent, candidates, relationship context, visibility, evidence, provenance and outcome records.","evidence_model":"Candidate claims remain distinct from verification evidence and observed outcomes.","economic_model":"May discover economic opportunities but does not replace Value, Market or I/O semantics.","pulse_model":"Seek outcomes and feedback can emit canonical Pulse observations.","continuity_model":"Active seeks, evidence and obligations remain recoverable across provider replacement and handoffs.","exit_handoff":"Transfer active seek state, constraints, candidates, evidence, consent/authority context and pending actions to the receiving capability.","compatibility_identifiers":["SPOTIST SEEK","universal SEEK"]}
