{"schema_version":"1.0.0","product_id":"omni-operating-surface","name":"OMNI Operating Surface","status":"active","purpose":"Provide an operating, routing, runtime and provider-integration surface that executes against canonical OMNII and ABBA contracts.","entities":["human","organization","AI system","agent","service","provider","device"],"domain_capabilities":["runtime","routing","provider integration","event/state management"],"consumed_capabilities":["cap.identity","cap.authority","cap.workflow","cap.interoperability","cap.discovery","cap.matching"],"provided_capabilities":["operating/integration composition"],"workflows":["intent→capability→provider→execution→observe→record→reconcile"],"interfaces":["API","MCP","A2A","terminal/browser","agent/tool"],"providers_adapters":["MCP","A2A","API","external provider adapters"],"authority_model":"Routes within declared authority; it does not issue constitutional authority or replace ABBA.","data_model":"Canonical runtime events and states with provenance; provider identifiers remain non-canonical.","evidence_model":"Retains execution, retry, failure, cancellation and provider evidence without silent deletion.","economic_model":"Operating surface only; economic meaning is delegated to canonical Value/I/O and economic compositions.","pulse_model":"Routes observable outcomes and feedback to canonical Pulse pathways.","continuity_model":"Provider replacement, retries and degraded execution remain attributable and recoverable.","exit_handoff":"Preserve canonical entity, state, event, evidence and obligation references for receiving capability/product.","compatibility_identifiers":["repo:carbonactual/omni","product_id:omni"]}
