{"schema_version":"1.0.0","product_id":"desk-workspace","name":"DESK Participant Workspace","status":"planned","purpose":"Provide a participant dashboard/workspace that composes economic, identity, activity, obligation, opportunity and notification capabilities without owning their universal semantics.","entities":["human","organization","account","asset","order","transaction","obligation","opportunity","document"],"domain_capabilities":["participant dashboard","workspace composition","activity view","economic context view"],"consumed_capabilities":["cap.identity","cap.discovery","cap.matching","cap.authority","cap.workflow","cap.interoperability"],"provided_capabilities":["participant workspace composition"],"workflows":["authenticate→compose context→view→act through governed capability→record→handoff"],"interfaces":["web/mobile UI","API"],"providers_adapters":["dashboard widgets and provider adapters"],"authority_model":"Dashboard presentation does not grant authority; consequential actions resolve through canonical authority and authorization.","data_model":"References canonical records instead of creating parallel identity, value or ledger semantics.","evidence_model":"Displays and links source evidence; presentation is not evidence by itself.","economic_model":"Presentation/composition surface only.","pulse_model":"May present Pulse signals without redefining them.","continuity_model":"Workspace replacement must preserve participant records and active obligations.","exit_handoff":"Persist context and links to canonical records; hand active work to the receiving capability.","compatibility_identifiers":["DESK","participant dashboard","historical desk concept"]}
